nome,avaliacao,reviews,telefone,endereco,site,nicho,cidade
Clinica Estetica BH,"5,0",,(31) 99386-6785,"R. Maria Macedo, nº 233 - sala: 710",http://clinicaesteticabh.com.br/,clínicas de estética,São Paulo
AC Clínica de Estética,"4,5",,(31) 98846-8884,"R. São Paulo, 1966 - 3° andar",,clínicas de estética,São Paulo
Spa Training - Clínica de Estética,"5,0",,(31) 98754-0960,"R. São Paulo, 1966 - 401",http://www.spatraining.com.br/,clínicas de estética,São Paulo
"Pró Estética Vila Mariana, Ultraformer, Fotona, Tratamento Gordura Localizada, Botox Facial, Lipo Sem Cortes","4,8",,(11) 93369-7973,"R. Estado de Israel, 225",https://proesteticaoficial.com.br/,clínicas de estética,São Paulo
"Clínica Pró Estética Perdizes, Ultraformer MPT, Fotona, Gordura Localizada, Botox Facial, Lipo Sem Cortes, Hipro, Liftera","4,8",,(11) 97444-5843,"Rua Desembargador do Vale, 219",https://proesteticaoficial.com.br/,clínicas de estética,São Paulo
"Clínica Pró Estética Vila Madalena, Ultraformer MPT, Fotona, Tratamento Gordura Localizada, Botox Facial, Lipo Sem Cortes","4,8",,(11) 94078-5377,"R. Wisard, 288 - Sala 234",https://proesteticaoficial.com.br/,clínicas de estética,São Paulo
Clínica de Estética Salomão,"4,9",,(11) 99934-9773,"Av. Paulista, 2006 - 3 Andar Cj. 306",,clínicas de estética,São Paulo
Clínica Jessica Leistayo,"4,6",,(11) 93438-4016,"R. Maurício Francisco Klabin, 205",https://jessicaleistayo.com/,clínicas de estética,São Paulo
